format,describe,detail,Webpage,32bit,64bit,downloads source file
apache2,The web server,Apache2 Web server.Can use .htaccess.SSL with certbot.,https://httpd.apache.org/,TRUE,TRUE,apache2
fonts-noto,No More Tofu Font,If you can see tofu fonts let's install this font to fix!,,TRUE,TRUE,fonts-noto
wine,run .exe file,Can use .exe file on RaspberryPi!,https://www.winehq.org/,TRUE,TRUE,wine-windows
winetricks,Wine tools,This tools is so helpful for wine,https://github.com/Winetricks/winetricks,TRUE,TRUE,wine-tricks
scratch3,Easy block programming,Made by MIT.Easy-To-Program but can make great programs!,https://scratch.mit.edu,TRUE,TRUE,scratch3
certbot,minute to SSL your web,For apache2 and etc.3 months ssl but you can regenerate anytime!,,TRUE,TRUE,certbot
php-7.3,Tool to use PHP,You must install if you install web server client!,,TRUE,TRUE,php-7.3
